{
  "identity": {
    "workspace": "bapx.in",
    "primaryOrg": "Bapx Media Hub",
    "currentUser": {
      "name": "Getwin Harris",
      "email": "bapxmediahub@gmail.com",
      "role": "Owner"
    },
    "billing": {
      "trialDays": 60,
      "plans": [
        {
          "name": "Agents workspace",
          "price": "Roadmap",
          "summary": "agents.bapx.in command center for connectors, skills, company repos, workflows, and hosted or user-owned execution targets."
        },
        {
          "name": "Unified platform",
          "price": "Account-based",
          "summary": "One login, billing profile, OAuth inventory, products, hosted apps, API keys, MCP access, and team permissions across bapX."
        },
        {
          "name": "Media Hub",
          "price": "Custom",
          "summary": "Web, social, automation, ads, SEO, content, and business operations priced to the client scope."
        }
      ]
    }
  },
  "contact": {
    "email": "bapxmediahub@gmail.com",
    "phone": "+91 9629433594",
    "telHref": "tel:+919629433594",
    "address": "Coimbatore, TN, India"
  },
  "oauthProviders": [
    {
      "id": "google",
      "name": "Google",
      "status": "planned",
      "callbackUrl": "https://api.bapx.in/auth/oauth/google/callback",
      "scope": "Unified login, user profile, email verification"
    },
    {
      "id": "github",
      "name": "GitHub",
      "status": "planned",
      "callbackUrl": "https://api.bapx.in/auth/oauth/github/callback",
      "scope": "Developer login, repo contribution, package install context"
    },
    {
      "id": "openai",
      "name": "OpenAI",
      "status": "planned",
      "callbackUrl": "https://api.bapx.in/auth/oauth/openai/callback",
      "scope": "ChatGPT connector identity and user-token handoff"
    },
    {
      "id": "apple",
      "name": "Apple",
      "status": "planned",
      "callbackUrl": "https://api.bapx.in/auth/oauth/apple/callback",
      "scope": "Consumer login for mobile and privacy-forward accounts"
    }
  ],
  "products": [
    {
      "id": "agents",
      "name": "Agents",
      "host": "agents.bapx.in",
      "status": "primary product repo",
      "plan": "@bapx/agent",
      "description": "Agent command center for company-as-git-repo workspaces, connectors, skills, automations, knowledge graph records, and governed execution targets."
    },
    {
      "id": "platform",
      "name": "Platform",
      "host": "platform.bapx.in",
      "status": "unified dashboard",
      "plan": "Unified account",
      "description": "Signed-in user dashboard for login, products, billing, subscriptions, hosted apps, connectors, and account-level API/MCP access."
    },
    {
      "id": "mediahub",
      "name": "Bapx Media Hub",
      "host": "mediahub.bapx.in",
      "status": "company service surface",
      "plan": "custom",
      "description": "Company services, client portfolio, web, social, automation, ads, SEO, content, and business presence operations driven from company blog content."
    },
    {
      "id": "api",
      "name": "API and MCP",
      "host": "api.bapx.in",
      "status": "gateway",
      "plan": "schema-first contracts",
      "description": "Shared API and MCP gateway for product APIs, connector contracts, schemas, and agent-facing integrations."
    }
  ],
  "platformNav": [
    {
      "label": "Home",
      "href": "https://platform.bapx.in"
    },
    {
      "label": "Products",
      "href": "https://platform.bapx.in/products"
    },
    {
      "label": "Agents",
      "href": "https://agents.bapx.in"
    },
    {
      "label": "Connectors",
      "href": "https://platform.bapx.in/connectors"
    },
    {
      "label": "Media Hub",
      "href": "https://mediahub.bapx.in"
    },
    {
      "label": "API Keys",
      "href": "https://platform.bapx.in/api-keys"
    },
    {
      "label": "Billing",
      "href": "https://platform.bapx.in/billing"
    },
    {
      "label": "Blog",
      "href": "https://blog.bapx.in"
    },
    {
      "label": "Settings",
      "href": "https://platform.bapx.in/settings"
    }
  ],
  "adminNav": [
    {
      "label": "Control",
      "href": "https://admin.bapx.in"
    },
    {
      "label": "Files",
      "href": "https://admin.bapx.in/files"
    },
    {
      "label": "Repos",
      "href": "https://admin.bapx.in/repos"
    },
    {
      "label": "Codex",
      "href": "https://admin.bapx.in/codex"
    },
    {
      "label": "Maps",
      "href": "https://admin.bapx.in/maps"
    },
    {
      "label": "Schemas",
      "href": "https://admin.bapx.in/schemas"
    },
    {
      "label": "Users",
      "href": "https://admin.bapx.in/users"
    },
    {
      "label": "Connectors",
      "href": "https://admin.bapx.in/connectors"
    },
    {
      "label": "Billing",
      "href": "https://admin.bapx.in/billing"
    },
    {
      "label": "Publishing",
      "href": "https://admin.bapx.in/publishing"
    },
    {
      "label": "Releases",
      "href": "https://admin.bapx.in/releases"
    },
    {
      "label": "Team",
      "href": "https://admin.bapx.in/team"
    }
  ],
  "adminTabs": [
    {
      "label": "General"
    },
    {
      "label": "OAuth"
    },
    {
      "label": "Billing"
    },
    {
      "label": "Blogs"
    },
    {
      "label": "Projects"
    },
    {
      "label": "Connectors"
    },
    {
      "label": "Schemas"
    },
    {
      "label": "Maps"
    },
    {
      "label": "OKF"
    }
  ],
  "ecosystemBackend": {
    "name": "bapX ecosystem backend",
    "runtime": "Node.js + TypeScript",
    "dataStore": "JSON files with documented JSON Schema",
    "policy": "Build the central bapX ecosystem backend as first-party Node.js/TypeScript with JSON-schema-first company, project, connector, workflow, content, billing, release, and admin records. SQL is not the product data model for agentic work. If SQL/vector internals exist later, expose them only behind generated JSON Schemas, TypeScript contracts, and agent-readable files.",
    "root": "/root/bapx.in",
    "packagesRoot": "/root/bapx.in/project-packages-git"
  },
  "billingProviders": [
    {
      "id": "razorpay",
      "name": "Razorpay",
      "status": "primary-planned",
      "scope": "India-first subscriptions, invoices, payment links, customer billing state, webhook reconciliation, and admin billing review."
    }
  ],
  "workspaceProjects": [
    {
      "name": "ecosystem-ui",
      "path": "/root/bapx.in/project-packages-git/ecosystem-ui",
      "role": "Public bapX UI for bapx.in, platform, admin, docs, blog, and Media Hub surfaces."
    },
    {
      "name": "agents",
      "path": "/root/bapx.in/project-packages-git/agents",
      "role": "Primary agents.bapx.in repo and @bapx/agent package direction."
    },
    {
      "name": "workspace map",
      "path": "/root/bapx.in/map.mmd",
      "role": "Combined ecosystem map across repos, domains, routes, package boundaries, and file roots."
    }
  ],
  "adminPanels": [
    {
      "title": "Files and workspace roots",
      "summary": "Inspect /root/bapx.in, project-package-git repos, docs, maps, schemas, package files, generated artifacts, and deploy state."
    },
    {
      "title": "Repo shipping tracker",
      "summary": "Track what each Git repo is shipping, current branch, linked issue, PR, validation result, map freshness, and deployment target."
    },
    {
      "title": "Codex terminal and sessions",
      "summary": "Open project-aware Codex CLI/terminal sessions for ecosystem maintenance, deploys, map generation, repo checks, and issue-first work."
    },
    {
      "title": "Whole ecosystem map",
      "summary": "Read /root/bapx.in/map.mmd plus each repo map before changing routing, backend contracts, schemas, docs, or automations."
    },
    {
      "title": "JSON schemas and records",
      "summary": "Manage JSON Schemas for companies, projects, connectors, workflows, blog posts, releases, billing state, users, and admin operations."
    },
    {
      "title": "Users, roles, and OAuth",
      "summary": "Manage unified users, OAuth providers, team roles, project membership, app entitlements, and session policy."
    },
    {
      "title": "Connector inventory",
      "summary": "Track GitHub, Google Workspace, OpenAI, OpenRouter, Firecrawl, Playwright, SSH, Vercel, webhook, cron, local URL, and remote URL connectors."
    },
    {
      "title": "Razorpay billing",
      "summary": "Manage billing records, subscriptions, invoices, payment links, webhook reconciliation, and plan state through Razorpay-backed contracts."
    },
    {
      "title": "Publishing workflow",
      "summary": "Publish blog, research, open source, release notes, docs, Media Hub updates, and SEO content from markdown-like JSON records."
    },
    {
      "title": "Team workflows",
      "summary": "Run internal bapX team operations, client approvals, job tracking, automations, content workflow, and ecosystem build tasks."
    }
  ],
  "metrics": [
    {
      "label": "Active repos",
      "value": "2",
      "hint": "ecosystem-ui and agents"
    },
    {
      "label": "Primary product",
      "value": "agents.bapx.in",
      "hint": "@bapx/agent command center"
    },
    {
      "label": "MCP gateway",
      "value": "api.bapx.in/mcp",
      "hint": "Shared agent gateway"
    },
    {
      "label": "Content lanes",
      "value": "4",
      "hint": "Research, open source, company, releases"
    }
  ],
  "onboarding": [
    {
      "label": "Create unified account",
      "state": "done"
    },
    {
      "label": "Connect Google, GitHub, OpenAI, or Apple OAuth",
      "state": "pending"
    },
    {
      "label": "Add connector inventory for GitHub, Google Workspace, OpenRouter, Firecrawl, Playwright, SSH, Vercel, cron, webhook, local URL, and remote URL",
      "state": "pending"
    },
    {
      "label": "Create company/project JSON records and map them to repos",